name,capacity,category,descriptionFr,descriptionEn,photoThumbnails,popularityScore,price,subCategories,eanCode,itemHeightRef,unityType
FE EPOISSES AOP 250G,3402.59,cheese,"Découvrez le Fromage Epoisses AOP, un joyau de Bourgogne captivé par son arôme envoûtant et sa texture riche. Dégustez-le avec un pain bisou ou une figue sèche pour un délice unique, idéalement associé à un vin rouge.","A rich, bold cow's milk cheese with a complex, spicy flavor and aromatic notes. Pair with a full-bodied red wine, crusty bread, and a touch of mustard for balance.",https://rappel.conso.gouv.fr/image/ec9ce5bf-ec7e-478b-922a-00ea16e3ee0b.jpg,0,8.2,,2663495000000,43439171,g
P&C MORBIER AOP LC 6K5,7037.17,cheese,"Ce fromage Morbier AOP, à la croûte brune et texture veloutée, dévoile des arômes épicés et lactiques. Idéal avec un pain au levain, un verre de Beaujolais ou une noisette d'amandes.","A sophisticated blend of earthy, buttery notes with a hint of sweetness, P&C MORBIER AOP LC 6K5 pairs beautifully with Pouilly-Fuissé wine and a crusty baguette, enhanced by a drizzle of honey.",https://www.fromagerie-stbonnetdesalers.com/media/images/catalog/article/97/mediumDetail/73.JPG,0,17.2,,2663661000000,43439334,g
GP CANTAL JEUNE LAIT CRU AOP5K,7204.42,cheese,"Découvrez notre Cantal jeune lait cru AOP5K, une explosion de saveurs douces et piquantes.","GP CANTAL JEUNE LAIT CRU AOP5K is a delicate, smoky-sweet cow's milk cheese with a copper-kissed rind. Its velvety interior pairs beautifully with a dry rosé or Sancerre, crusty baguette, and a drizzle of honey.",https://www.lepanierducausse.fr/1413-large_default/tomme-des-cazelles-fromage-de-brebis-pasteurise.jpg,0,18.0,,2891827000000,9919362372,g
TOMME CAZELLES BREBIS 4.4ENV,8321.78,cheese,"La Tomme Cazelles Brebis, une délicieuse tomme au lait de brebis, affineée avec soin pour un équilibre unique entre douceur et richesse. Idéale sur un pain au levain légèrement salé, accompagnée d'une olive oiliante ou d'un miel doux, ce fromage se marie à merveille avec un Côtes du Rhône.","Discover our TOMME CAZELLES BREBIS 4.4ENV, a harmonious blend of nutty, earthy flavors with a subtly creamy texture. Pair it with a bold red wine like Syrah or Grenache, a crusty baguette, and a drizzle of honey or olive oil for an unforgettable experience.",https://www.fromagerieantony.fr/wp-content/uploads/2023/09/Tomme-de-Chartreuse.jpg,0,21.0,,2843639000000,19749800,g
TOMME DE MONTAGNE CHARTREUSE,9147.4,cheese,"Découvrez notre Tomme de Montagne Chartreuse : une texture onctueuse, un bouquet piquant et épicé, sublimée par des herbes d'Alpe. Idéale avec une quiche Lorraine ou un verre de Syrah.","Tomme de Montagne Chartreuse, a luscious cow’s milk cheese from Savoy, offers nutty caramel and earthy hazelnut notes, pairing beautifully with robust red wine, crusty bread, and membrillo.",https://www.frenchclick.co.uk/images/product/medium/9901.jpg,0,23.1,,204950000000,99006097,g
PETIT POT CREME CHOCOLAT,742.9,cheese,"Ce fromage PETIT POT CREME CHOCOLAT est une véritable explosion de douceur : sa texture onctueuse et son velouté envoûtent les papilles, tandis que ses notes de cacao intenses et équilibrées ravissent les amateurs de saveurs complexes. Idéal avec un vin rouge légèrement acide, une brioche ou des amandes, ce petit pot est l'allié parfait pour un moment gourmand et raffiné.","Indulge in the luscious Petit Pot Crème Chocolat, a velvety blend of rich chocolate and creamy dairy, perfect paired with crusty bread, fig jam, or a glass of sweet red wine.",http://www.primegourmet.ae/cdn/shop/products/reblochon-fermier-aop-cows-milk-500g-542688.png?v=1681725400,0,1.9,,3483130046402,99011577,g
P'TIT BASQUE PUR BREBIS 660G,10278.37,cheese,"Découvrez le P'TIT BASQUE PUR BREBIS, une explosion de douceur et de caractère en 660g. Profitez-en avec un pain au levain et un verre de vin rosé sec.","Indulge in P'TIT BASQUE PUR BREBIS 660G, a bold Basque sheep's milk cheese with rich, tangy layers. Pair with Bordeaux wine, crusty bread, and fig jam for an unforgettable experience.",https://www.coursesu.com/dw/image/v2/BBQX_PRD/on/demandware.static/-/Sites-digitalu-master-catalog/default/dw8549e10d/2635574000002_B1NG_2448733_S11.png?sw=388&sh=388&sm=fit,0,26.6,,2663545000000,43439455,g
REBLOCHON FERMIER AOP,12488.86,cheese,"Découvrez le Reblochon Fermier AOP, un fromage à pâte molle, riche et onctueux, aux arômes subtils de foin coupé. Idéal avec une quiche Lorraine, des crêpes ou une bière blonde.","Reblochon Fermier AOP, a luscious, nutty French cow's milk cheese with a buttery, ethereal quality, pairs beautifully with crisp white wines like Chardonnay or Riesling, crusty brioche, and a touch of quince paste for an unforgettable experience.",https://images.openfoodfacts.org/images/products/325/039/110/5335/front_fr.30.400.jpg,0,33.0,,204610000000,99041875,g
ITCHEBAI CHEVRE&BREBIS 4K5,9708.34,cheese,"Ce fromage ITCHEBAI CHEVRE&BREBIS 4K5 est une véritable explosion de saveurs,alliant la douceur du chèvre et le velouté de la brebis. Sa croûte légèrement piquante se marie à merveille avec un pain de brie ou une simple baguette. Pour accompagner ce délice, optez pour un vin blanc sec, comme un Sauvignon, et des figues séchées ou une noisette de miel. Un moment de pur bonheur !","Savor the luscious, velvety notes of ITCHEBAI Chevre&Brebis, a harmonious blend of goat and sheep milk cheeses. Pair with bold red wines, crusty baguette, and a drizzle of honey for an unforgettable experience.",https://preprod.lespetiteslaiteries.fr/wp-content/uploads/2020/10/PELISSONNE-DARDECHE.png,0,25.9,,2831762000000,24105511,g
FE P&C CHAOURCE AOP 250G,1676.18,cheese,"Découvrez notre Chaource AOP : une douceur en bouche avec une croûte parfumée et une texture onctueuse. Idéalement accompagné d'un pain rustique, d'une figue confite ou d'un verre de Chablis.","Savor the luscious creaminess of FE P&C Chaource AOP from Burgundy, where its buttery layers meld with nutty undertones—pair it with a crisp Chardonnay or drizzle with honey for a divine experience.",https://www.mons-fromages.com/media/cache/sylius_large/33/9b/6a2848ca6524deb35c4bdfcd18f5.jpg,0,4.6,,3250391105335,43434115,g
PELISSONNE D'ARDECHE,8121.44,cheese,"Fromage Pelissonne d'Ardèche : une douceur régalienne enrobée de pâte onctueuse et légèrement épicée, idéale avec un vin blanc sec ou une baguette artisanale, accompagnée de figues confites ou d'une pommade à l'ail.","Pelissonne d'Ardeche: A rare gem from France's Rhone Valley, offering a spicy aroma and rich flavor. Handcrafted with care, it pairs perfectly with Syrah wine and a touch of Comté for an unforgettable experience.",https://www.fromage-pouillot.fr/98/comte-affine-24-mois-marcel-petite.jpg,0,22.6,,204260000000,99041839,g
TOMME DE TARENTAISE,6619.02,cheese,"La Tomme de Tarentaise, ce fromage à pâte cuite dévoile des nuances subtiles entre douceur et complexité. Sa croûte légèrement fumée révèle une texture onctueuse et un équilibre parfait entre le beurre et les notes lactées. Idéale pour la raclette ou le fondue, elle s'accorde à merveille avec un vin rouge corsé et un pain artisanal. Un compagnon idéal pour les moments conviviaux, à déguster en compagnie d'une compote de pommes ou d'une salade verte.","Tomme de Tarentaise is a creamy, nutty cow's milk cheese from Savoy, France, with a buttery texture and subtle herbal notes. Pair it with a dry white wine, crusty bread, or a drizzle of honey for a harmonious balance of flavors.",https://cdn.intermarche.com/fr/Content/images/boitmal/produit/zoom/DEB9C7B96108D785F5CDE6A6AF377521.jpg,0,18.8,,204250000000,99041838,g
COMTE 24 MOIS,13073.14,cheese,"Le Comté 24 mois est une véritable délice pour les amoureux de fromages. Ce fromage affiné offre des nuances subtiles : notes beurrées, légèrement sucrée et saline, avec un velouté harmonieuse. Idéal sur une planche, en accord avec un vin rouge comme le Bourgogne ou une bière ale, accompagné d'un pain bisou ou de noisettes croustillantes. Une gourmandise authentique et unique.","Discover Comte 24 Mois, a 24-month-aged gem from France's Jura region. Its rich, nutty flavor with hints of dried fruit pairs perfectly with a bold red wine, crisp white, or crusty bread—truly a treat for cheese enthusiasts.",https://lechariotafromages.fr/1460-large_default/brocciu-frais-aop.jpg,0,38.7,,204100000000,99041352,g
COMTE VAGNE AOP 18 MOIS 5KG,2490.98,cheese,"Ce Comté Vagnes AOP, mature pendant 18 mois, est une véritable explosion de saveurs équilibrées. Son goût rappelle des nuances subtiles de noisette et de fumé, avec une texture onctueuse et légèrement croquante à la fois. Accompagnez-le d'un verre de Savagnin pour un accord parfait, ou tartinez-le sur une baguette rustique. Ajoutez une petite quenelle de miel pour un contraste délicieux. Ce fromage est une invitation à explorer les richesses du terroir et des traditions françaises, avec sa robe略brune et son bouquet envoûtant.","Discover the nutty, caramel-rich depth of Comte Vagne AOP 18 Mois, perfectly paired with a crisp Chardonnay or crusty baguette.",https://dojwn62xby8qn.cloudfront.net/public/offer_presentations/product/10719-1542380100.jpg,0,7.4,,2663568000000,43439371,g
BROCCIU FRAIS FERMIER AOP,2999.3,cheese,"Le Brocciu Frais Fermier AOP, une douceur corsaire à la texture onctueuse, idéalement associé à un vin blanc sec ou une baguette.","Discover Corsica’s Brocciu Frais Fermier AOP—a luscious, silken goat’s milk gem with a zesty tang. Pair with crisp Sauvignon Blanc, crusty country bread, and sweet figs for a harmonious blend of flavors that melt into your mouth.",https://www.leguidedufromage.com/files/1/z2010281431560.jpg,0,8.9,,3429881511936,99052839,g
